name	hallmark	disease
STS	PEROXISOME	Cirrhosis Cervical_Intraepithelial_Neoplasia_Grade_2/3 Central_neuroblastoma Neoplasms Essential_Tremor Malignant_neoplasm_of_large_intestine Ichthyosis,_X-Linked Smith-Lemli-Opitz_Syndrome High-Grade_Squamous_Intraepithelial_Lesions Psychotic_Disorders Noninfiltrating_Intraductal_Carcinoma Azoospermia Colon_Carcinoma Rheumatoid_Arthritis Glioblastoma Obesity Malignant_neoplasm_of_prostate Low_Grade_Squamous_Intraepithelial_Neoplasia Ichthyoses Chronic_Periodontitis Adenocarcinoma_of_pancreas Colonic_Neoplasms Arteriosclerosis Trichohepatoenteric_Syndrome Multiple_Sulfatase_Deficiency_Disease Condylomata_Acuminata Malignant_neoplasm_of_lung Endometriosis Osteosarcoma_of_bone Alzheimer's_Disease Neuroblastoma Familial_Mediterranean_Fever Premature_Menopause Glioblastoma_Multiforme Renal_Cell_Carcinoma Malignant_neoplasm_of_breast Colorectal_Cancer Malignant_tumor_of_colon Corneal_dystrophy Carcinoma_of_bladder Cervical_Squamous_Intraepithelial_Neoplasia Nonorganic_psychosis Cervical_Intraepithelial_Neoplasia High-Grade_Prostatic_Intraepithelial_Neoplasia Malignant_Peripheral_Nerve_Sheath_Tumor Ovarian_Carcinoma Anaplastic_Oligoastrocytoma Cervical_Squamous_Intraepithelial_Neoplasia_1 Liver_Cirrhosis Polycystic_Ovary_Syndrome Scaly_skin Congenital_Nonbullous_Ichthyosiform_Erythroderma Albinism,_Ocular Meningitis,_Pneumococcal Cryptorchidism CATARACT,_AUTOSOMAL_DOMINANT Eczema Endometrial_Hyperplasia Ichthyosis_Vulgaris vaginalis Mammary_Neoplasms Adenovirus_Infections Memory_impairment Non-Small_Cell_Lung_Carcinoma Benign_Prostatic_Hyperplasia Pancreatitis,_Chronic Steroid_Sulfatase_Deficiency_Disease Inborn_Errors_of_Metabolism Infectious_Otitis_Media Retention_hyperkeratosis Prostate_carcinoma Degenerative_polyarthritis Smith-Magenis_syndrome Infiltrating_Cervical_Carcinoma Neoplasm_Metastasis Endometrial_Carcinoma Squamous_cell_carcinoma Childhood_Osteosarcoma Liver_neoplasms HIV_Infections Immune_thrombocytopenic_purpura Cervix_Diseases Hereditary_hemochromatosis Kallmann_Syndrome Adenoma_of_large_intestine Deficiency_of_sulfatase Atherosclerosis Malignant_neoplasm_of_liver Hypogonadism Vaginal_intraepithelial_neoplasia Anal_intraepithelial_neoplasia Trisomy_X_syndrome Cervical_high_grade_squamous_intraepithelial_lesion Carcinogenesis ALZHEIMER_DISEASE_5 Intellectual_Disability XX_males Colorectal_Neoplasms B-Cell_Lymphomas Breast_Carcinoma Neoplastic_disease Congenital_chromosomal_disease Carcinoma_in_situ_of_uterine_cervix Amyloidosis Lung_Neoplasms Dermatologic_disorders Congenital_ichthyosis Androgen-Insensitivity_Syndrome melanoma Klinefelter_Syndrome Melanocytic_nevus Dwarfism Liver_and_Intrahepatic_Biliary_Tract_Carcinoma cervical_cancer Mental_Retardation,_X-Linked_1 Malignant_neoplasm_of_urinary_bladder Mental_Retardation Liver_carcinoma Osteosarcoma Hypoparathyroidism Familial_Alzheimer_Disease_(FAD) Adenocarcinoma Cervical_intraepithelial_neoplasia_grade_1 Bladder_Neoplasm Otitis_Media Placental_Steroid_Sulfatase_Deficiency Carcinoma_of_lung Respiratory_Syncytial_Virus_Infections Chronic_Infantile_Neurological,_Cutaneous,_and_Articular_Syndrome Colorectal_Carcinoma Primary_malignant_neoplasm_of_lung Tumor_Progression Ovarian_Failure,_Premature Chagas_Disease Adenocarcinoma_in_Situ Cholera Cervical_intraepithelial_neoplasia_grade_2 Encephalitis Triploidy_syndrome Barakat_syndrome High_Grade_Cervical_Intraepithelial_Neoplasia Ichthyosiform_Erythroderma,_Congenital Childhood_asthma Adenocarcinoma_Of_Esophagus Chondrodysplasia_Punctata liposarcoma Cervix_carcinoma Melanocytic_nevus_of_skin Cervical_Squamous_Cell_Carcinoma Malignant_neoplasm_of_ovary Neurodevelopmental_Disorders Malignant_tumor_of_cervix Autistic_Disorder Attention_deficit_hyperactivity_disorder
GDA	COAGULATION	Amyotrophic_Lateral_Sclerosis
GAD2	FATTY_ACID_METABOLISM	Spasm insulinoma Huntington_Disease Anxiety_Disorders Muscular_stiffness Anxiety Diabetes_Mellitus,_Non-Insulin-Dependent Pain Precocious_pubarche Schizoaffective_Disorder PANIC_DISORDER_1 Kidney_Diseases Chronic_pain Mood_Disorders Stiff-Person_Syndrome Obsessive-Compulsive_Disorder Retinal_Diseases Parkinson_Disease NEUROTICISM Narcolepsy Diabetes,_Autoimmune Hyperalgesia,_Thermal Latent_Autoimmune_Diabetes_in_Adults Alcoholic_Intoxication,_Chronic Autoimmune_Primary_Adrenal_Insufficiency Autistic_Disorder Myxoid_cyst Coxsackievirus_Infections Obesity,_Morbid Smith-Magenis_syndrome Diabetes_Mellitus Connective_tissue_inflammation Metabolic_Diseases Parkinsonian_Disorders Hypoglycemia Diagnosis,_Psychiatric Major_Depressive_Disorder MYOTONIC_DYSTROPHY_1 Latent_autoimmune_diabetes_mellitus_in_adult Diabetes Seizures Thyroid_Diseases West_Nile_viral_infection Panic_Disorder Juvenile_Neuronal_Ceroid_Lipofuscinosis Enterovirus_Infections Prediabetes_syndrome Addison_Disease Schizophrenia Autoimmune_Diseases Bronchopulmonary_Dysplasia Obesity Graves_Disease Pediatric_Obesity Malnutrition Agnosia_for_Pain Completed_Suicide Generalized_Anxiety_Disorder Hashimoto_Disease Neuralgia Malignant_neoplasm_of_pancreas Thyrotoxicosis Bipolar_Disorder Diabetes_Mellitus,_Insulin-Dependent Abnormal_behavior Pancreatic_carcinoma Borderline_Personality_Disorder Unipolar_Depression
MSRB1	COMPLEMENT	Bilateral_cataracts_(disorder) Schizophrenia Cataract Rectal_Carcinoma
CYP2E1	XENOBIOTIC_METABOLISM	Hepatitis_B Colorectal_Carcinoma Mucocutaneous_Lymph_Node_Syndrome Vomiting Anxiety Cooley's_anemia Chronic_Obstructive_Airway_Disease Gastritis,_Atrophic cervical_cancer Cardiomyopathy,_Alcoholic Schizophrenia Infection_caused_by_Helicobacter_pylori Hyperglycemia Liver_carcinoma Carcinoma,_Small_Cell Bladder_Neoplasm Adenoma_of_large_intestine Malignant_neoplasm_of_lung Hepatitis Fibrosis_of_pancreas Rectal_Carcinoma Adenocarcinoma_of_lung_(disorder) Leukoplakia Liver_Failure,_Acute Heart_failure Alcoholic_Liver_Diseases Tuberculosis Fetal_Alcohol_Syndrome Malignant_neoplasm_of_prostate Gastric_Adenocarcinoma Pancreatitis Squamous_cell_carcinoma_of_lung Chronic_liver_disease MYELODYSPLASTIC_SYNDROME Adenoviral_infections Pharyngeal_Carcinoma Pancreatitis,_Chronic Neoplasm_Metastasis Hepatitis,_Autoimmune Epithelial_hyperplasia Lung_Neoplasms Carcinoma,_Transitional_Cell Tobacco_Dependence Slow_acetylator_due_to_N-acetyltransferase_enzyme_variant Adenocarcinoma Colon_Carcinoma Alcohol-Related_Disorders Cardiomyopathy,_Familial_Idiopathic Lymphoma Nicotine_Dependence Heart_Diseases Hepatitis_C Alcoholic_Steatohepatitis Tuberculosis,_Pulmonary Nasopharyngeal_carcinoma Diabetes_Mellitus,_Insulin-Dependent Latent_Tuberculosis Urothelial_Carcinoma Fibrosis,_Liver Drug-Induced_Liver_Disease Alcohol_Related_Birth_Defect Diabetes Cirrhosis Cirrhosis_-_non-alcoholic Asthma Small_cell_carcinoma_of_lung Interstitial_lung_fibrosis Adult_Brain_Neoplasm Childhood_Leukemia Malignant_neoplasm_of_breast Esophageal_Neoplasms Arteriosclerosis Carcinoma_of_lung Peptic_Ulcer Acquired_aplastic_anemia Malignant_neoplasm_of_pharynx Periodontitis Alcoholic_Intoxication,_Chronic Vascular_lesions Cholestatic_liver_disease Cardiomyopathy,_Dilated Primary_malignant_neoplasm_of_lung Liver_diseases Breast_Carcinoma Glioma Hepatitis_A Malignant_neoplasm_of_gastrointestinal_tract Carcinogenesis Bronchitis,_Chronic Glioblastoma Leprosy Lip_and_Oral_Cavity_Carcinoma Squamous_intraepithelial_lesion Adenoma Kidney_Diseases Obesity Carcinoma_of_bladder Malignant_neoplasm_of_urinary_bladder Adrenoleukodystrophy Diabetes_Mellitus Non-Small_Cell_Lung_Carcinoma Mental_Depression Alcoholic_liver_damage Malignant_neoplasm_of_esophagus Liver_Cirrhosis Infection_by_Polymorphus Congestive_heart_failure Aplastic_Anemia Hepatocarcinogenesis Malignant_Head_and_Neck_Neoplasm Pseudohyperkalemia_Cardiff Fatty_Liver Hepatitis,_Drug-Induced Colorectal_Cancer Exanthema Leukemia,_Myelocytic,_Acute Adult_Acute_Lymphocytic_Leukemia Atherosclerosis Prostate_carcinoma Depressive_disorder Acute_lymphocytic_leukemia Pancreatitis,_Alcoholic Malignant_neoplasm_of_stomach Esophageal_carcinoma Gastric_Cardia_Carcinoma Hepatitis_C,_Chronic Lupus_Erythematosus,_Systemic Malignant_neoplasm_of_larynx Non-alcoholic_Fatty_Liver_Disease Halothane_Hepatitis Porphyria_Cutanea_Tarda Obsessions Lymphoma,_Follicular Anxiety_Disorders Chronic_gastritis Malignant_neoplasm_of_mouth Gastrointestinal_symptom Cervix_carcinoma Chronic_alcoholic_liver_disease Malignant_neoplasm_of_brain Acoustic_Neuroma Parkinson_Disease Carcinoma_of_larynx Malignant_tumor_of_cervix Retroviridae_Infections Pneumonia Malignant_Squamous_Cell_Neoplasm Steatohepatitis Congenital_chromosomal_disease Liver_neoplasms Neurilemmoma Alcohol_abuse Lymphoma,_Non-Hodgkin Cardiomyopathies Childhood_Acute_Lymphoblastic_Leukemia Squamous_cell_carcinoma Stomach_Carcinoma Nonalcoholic_Steatohepatitis Antisocial_Personality_Disorder Single_tumor Malignant_tumor_of_colon Liver_Cirrhosis,_Alcoholic Squamous_cell_carcinoma_of_esophagus Squamous_cell_carcinoma_of_the_head_and_neck
MYL6B	MYOGENESIS	
ATP1A3	APICAL_JUNCTION	CAPOS_syndrome Familial_Dystonia Brain_Diseases Neonatal_infection Hemiplegic_migraine Dystonia_Disorders Encephalopathies Optic_Atrophy Neurodevelopmental_Disorders Dystonia Parkinsonian_Disorders Parkinson_Disease MIGRAINE,_FAMILIAL_HEMIPLEGIC,_2 Bipolar_Disorder Dystonia,_Primary ALTERNATING_HEMIPLEGIA_OF_CHILDHOOD_2 Ataxia Clumsiness_-_motor_delay Talipes_cavus Motor_symptoms Retinoschisis,_Juvenile,_X-Linked Hemiplegia,_Crossed Cerebellar_Ataxia Alternating_hemiplegia_of_childhood Movement_Disorders nervous_system_disorder DYSTONIA_12 Congenital_pes_cavus Microcephaly Choreoathetosis Motor_Disorders Epilepsy Disturbance_of_consciousness Congenital_hypoplasia_of_adrenal_gland Weakness
HSD17B6	BILE_ACID_METABOLISM	Chronic_Kidney_Diseases Esophageal_carcinoma Spastic_Paraplegia Primary_malignant_neoplasm_of_lung Esophageal_Neoplasms Mental_Depression Cerebrovascular_accident Central_neuroblastoma Parkinson_Disease Neuromuscular_Diseases Malaria Hypoglycemia Cystic_renal_dysplasia Polycystic_Ovary_Syndrome Oncocytoma,_renal Metabolic_Diseases Stomach_Carcinoma Diabetes_Mellitus Attention_deficit_hyperactivity_disorder Mitochondrial_Encephalomyopathies Chronic_Kidney_Insufficiency leukemia Malignant_neoplasm_of_breast Endometrial_Carcinoma Carcinogenesis Liver_diseases Mitochondrial_Diseases Carcinoma_of_lung Acidosis,_Lactic Mitochondrial_encephalopathy X-linked_Adrenal_Hypoplasia Liver_carcinoma Autism_Spectrum_Disorders Cystic_Fibrosis Congestive_heart_failure Malignant_neoplasm_of_esophagus Cardiomyopathies Amyotrophic_Lateral_Sclerosis,_Sporadic Secondary_malignant_neoplasm_of_bone Ambiguous_Genitalia Ureteral_obstruction Inborn_Errors_of_Metabolism Ichthyoses Down_Syndrome Carcinoma_breast_stage_IV Childhood_Acute_Lymphoblastic_Leukemia Autistic_Disorder Histiocytoid_Cardiomyopathy Breast_Carcinoma Impaired_cognition Neuroblastoma Mammary_Neoplasms Chronic_granulomatous_disease Retinal_Dystrophies Albinism Essential_Hypertension MELAS_Syndrome melanoma Brain_Neoplasms Chronic_active_hepatitis Nicotinamide_adenine_dinucleotide_coenzyme_Q_reductase_deficiency Prostate_carcinoma Methemoglobinemia Classical_phenylketonuria Malignant_neoplasm_of_lung Malignant_neoplasm_of_endometrium Sjogren-Larsson_Syndrome Coffin-Lowry_syndrome Kidney_Neoplasm Pyruvate_Dehydrogenase_Complex_Deficiency_Disease Optic_Atrophy,_Hereditary,_Leber Squamous_cell_carcinoma Congenital_adrenal_hyperplasia Deficiency_of_lyase Mitochondrial_Respiratory_Chain_Deficiencies Neurodegenerative_Disorders Bipolar_Disorder 21-hydroxylase_deficiency Encephalopathies Glucocorticoid_deficiency CONSTRICTING_BANDS,_CONGENITAL Uterine_Corpus_Cancer Malignant_neoplasm_of_prostate Progressive_intrahepatic_cholestasis_(disorder) Chronic_heart_failure Ethylmalonic_encephalopathy Liver_neoplasms Huntington_Disease Multiple_Acyl_Coenzyme_A_Dehydrogenase_Deficiency Amenorrhea Stomach_Neoplasms Congenital_Abnormality Diabetes Antley-Bixler_Syndrome,_Autosomal_Dominant Leber_Congenital_Amaurosis Congenital_adrenal_hyperplasia_due_to_21_hydroxylase_deficiency Paresis Myopathy Congenital_ichthyosis Dermatitis,_Atopic Muscle_Weakness Paraganglioma Neoplasm_Metastasis Retinitis_Pigmentosa Leigh_Disease Malignant_neoplasm_of_stomach Alzheimer's_Disease
ERAP2	COMPLEMENT	Primary_malignant_neoplasm Autoimmune_Diseases Neuroblastoma Essential_Hypertension Virus_Diseases Crohn_Disease Spondylarthritis Malignant_Neoplasms Ankylosing_spondylitis Central_neuroblastoma Diabetes_Mellitus,_Insulin-Dependent HIV_Infections Birdshot_chorioretinopathy
CDK9	TGF_BETA_SIGNALING	leukemia Acute_leukemia Colorectal_Carcinoma Neuroblastoma Metastatic_melanoma Colorectal_Cancer Septicemia Malignant_Neoplasms Central_neuroblastoma Pancreatic_Neoplasm Refractory_cancer Inflammatory_disorder Astrocytoma Hematologic_Neoplasms Gestational_choriocarcinoma Liver_carcinoma Transient_Myeloproliferative_Disorder_of_Down_Syndrome Leukemogenesis Cardiomyopathies HIV_Infections Liver_neoplasms Adenocarcinoma_of_lung_(disorder) Multiple_Myeloma Neoplasm_Metastasis Lung_diseases Carcinogenesis Breast_Carcinoma Congestive_heart_failure Familial_multiple_trichoepitheliomata Lymphoma Chronic_Lymphocytic_Leukemia Glioblastoma Influenza Prostate_carcinoma Squamous_cell_carcinoma_of_the_head_and_neck Malignant_lymphoma,_lymphocytic,_intermediate_differentiation,_diffuse Heart_failure Alzheimer's_Disease Arteriosclerosis Malignant_neoplasm_of_prostate Solid_Neoplasm Atherosclerosis MIXED_LINEAGE_LEUKEMIA Ewings_sarcoma-primitive_neuroectodermal_tumor_(PNET) Hereditary_gingival_fibromatosis Neuroectodermal_Tumor,_Primitive Adenocarcinoma_Of_Esophagus melanoma Virus_Diseases Primary_malignant_neoplasm Sepsis Addictive_Behavior NUT_midline_carcinoma Ki-1+_Anaplastic_Large_Cell_Lymphoma Non-Small_Cell_Lung_Carcinoma Cytomegalovirus_Infections Leukemia,_Myelocytic,_Acute Malignant_neoplasm_of_breast Respiratory_Syncytial_Virus_Infections
DDX10	UNFOLDED_PROTEIN_RESPONSE	Acute_Myeloid_Leukemia_Arising_from_Previous_Myelodysplastic_Syndrome Malignant_neoplasm_of_breast Leukemogenesis Carcinogenesis Breast_Carcinoma Leukemia,_Myelocytic,_Acute
COL8A2	EPITHELIAL_MESENCHYMAL_TRANSITION	Polymorphous_corneal_dystrophy Focal_glomerulosclerosis Corneal_dystrophy,_Fuchs'_endothelial,_1 Liver_carcinoma Fish-Eye_Disease Diabetic_Nephropathy Keratoconus Connective_Tissue_Diseases CORNEAL_ENDOTHELIAL_DYSTROPHY_2 Fuchs_Endothelial_Dystrophy Congenital_hereditary_endothelial_dystrophy Glaucoma,_Primary_Open_Angle Degenerative_polyarthritis Retinal_Diseases Chandler_syndrome Fleck_corneal_dystrophy Corneal_dystrophy Eosinophilic_esophagitis
XDH	XENOBIOTIC_METABOLISM	Xanthinuria Carcinogenesis Endothelial_dysfunction Nephrolithiasis Malignant_neoplasm_of_lung Kidney_Calculi Carcinoma_of_lung Congenital_hypoplasia Columnar_Cell_Change_of_the_Breast Cardiovascular_Diseases Inflammatory_disorder Colon_Carcinoma Heart_failure Hypertensive_disease Arteriosclerosis Neoplasm_Metastasis Ovarian_Carcinoma Mammary_Neoplasms Chronic_Kidney_Diseases Primary_malignant_neoplasm_of_lung Malignant_neoplasm_of_breast Meningioma Epithelial_ovarian_cancer Atherosclerosis Congestive_heart_failure Xanthinuria,_Type_I Malignant_neoplasm_of_stomach Stomach_Carcinoma Xeroderma_pigmentosum,_group_A Colorectal_Cancer Malignant_tumor_of_colon Adenocarcinoma_of_lung_(disorder) Hypouricemia Metabolic_Diseases Pancreatitis Malignant_neoplasm_of_ovary Meningioma,_benign,_no_ICD-O_subtype Colorectal_Carcinoma Breast_Carcinoma
RAB27A	UV_RESPONSE_UP	Neoplasm_Metastasis Piebaldism Carcinoma_of_bladder Gastritis,_Atrophic Prostate_carcinoma X-Linked_Lymphoproliferative_Disorder melanoma Choroideremia Malignant_neoplasm_of_prostate Melanoma,_B16 Immune_System_Diseases Metastatic_Carcinoma Glioma Colorectal_Carcinoma leukemia Lymphohistiocytosis,_Hemophagocytic Immunologic_Deficiency_Syndromes Refractory_anemias Histiocytosis_haematophagic Asthma Nephropathic_cystinosis GRISCELLI_SYNDROME,_TYPE_2 Bladder_Neoplasm nervous_system_disorder Malignant_neoplasm_of_urinary_bladder Cystic_Fibrosis Hypopigmentation-immunodeficiency_disease Mammary_Neoplasms Secondary_malignant_neoplasm_of_lymph_node Albinism Hemophagocytic_Syndrome Tumor_Progression Rheumatoid_Arthritis Primary_immune_deficiency_disorder Liver_carcinoma Breast_Carcinoma Systemic_onset_juvenile_chronic_arthritis Hypopigmentation_disorder Malignant_neoplasm_of_breast ALBINOIDISM,_OCULOCUTANEOUS,_AUTOSOMAL_DOMINANT Juvenile_arthritis Colorectal_Cancer
WDR1	COAGULATION	Anaplastic_thyroid_carcinoma Uranostaphyloschisis Papillary_thyroid_carcinoma Cleft_palate,_isolated Macrothrombocytopenia Cleft_Palate Thyroid_Neoplasm Cyst melanoma Vesicular_Stomatitis Malignant_melanoma_of_eye Arteriosclerosis
MSRA	REACTIVE_OXIGEN_SPECIES_PATHWAY	Atherosclerosis_of_aorta Amyloidosis Fatty_Liver Neuroblastoma Vascular_Diseases Obesity Rheumatoid_Arthritis VITILIGO-ASSOCIATED_MULTIPLE_AUTOIMMUNE_DISEASE_SUSCEPTIBILITY_1_(finding) Parkinson_Disease Cardiovascular_Diseases Breast_Carcinoma Atrial_Fibrillation Cystic_Fibrosis Steatohepatitis Neonatal_intestinal_obstruction Myocardial_Infarction Dyslipidemias Myocardial_rupture Central_neuroblastoma Bipolar_I_disorder Alzheimer's_Disease Vitiligo MRSA_-_Methicillin_resistant_Staphylococcus_aureus_infection Meconium_ileus Pediatric_Obesity Deficiency_of_oxidase Arteriosclerosis Schizophrenia Atherosclerosis Hepatitis_B Malignant_neoplasm_of_breast Neoplasm_Metastasis Neurodegenerative_Disorders Liver_carcinoma
CYP2C18	XENOBIOTIC_METABOLISM	Drug_abuse Epilepsy Essential_Tremor Mammary_Neoplasms Drug_Resistant_Epilepsy Primary_malignant_neoplasm_of_lung Patent_ductus_arteriosus Malignant_neoplasm_of_breast Metabolic_Diseases Peptic_Ulcer Diabetes_Mellitus,_Non-Insulin-Dependent Coronary_Artery_Disease Breast_Carcinoma Coronary_Arteriosclerosis Dwarfism Carcinoma_of_lung Infection_caused_by_Helicobacter_pylori Malignant_neoplasm_of_lung Liver_carcinoma Sudden_infant_death_syndrome Hypertensive_disease Retinal_Diseases
MSH5	KRAS_SIGNALING_DN	Immunoglobulin_A_deficiency_(disorder) Premature_Menopause Lymphoma,_Non-Hodgkin Lupus_Erythematosus,_Systemic Ovarian_Failure,_Premature Non-obstructive_azoospermia Diabetes_Mellitus,_Insulin-Dependent Celiac_Disease Common_Variable_Immunodeficiency Male_infertility Azoospermia Malignant_neoplasm_of_ovary Prostate_carcinoma Oligospermia Malignant_neoplasm_of_prostate Turner_Syndrome Ovarian_Carcinoma
PAK3	PANCREAS_BETA_CELLS	Psychotic_Disorders Rheumatoid_Arthritis Ewings_sarcoma Mental_handicap Carcinoid_Tumor Malignant_tumor_of_cervix cervical_cancer Leukemia,_Myelocytic,_Acute Neuroendocrine_Tumors Nonorganic_psychosis Impaired_cognition Cognition_Disorders Mental_Retardation Macrocephaly Schizophrenia Pancreatic_carcinoma Malignant_neoplasm_of_pancreas Cervix_carcinoma Intellectual_Disability Thymic_Carcinoid_Tumor Lupus_Erythematosus,_Discoid HIV_Infections COLCHICINE_RESISTANCE Lupus_Erythematosus,_Systemic Epilepsy Mental_Retardation,_X-Linked Myeloid_Leukemia,_Chronic Mental_Retardation,_X-Linked_1 Virus_Diseases Neurodegenerative_Disorders leukemia ACTH_Syndrome,_Ectopic Chronic_schizophrenia Hepatitis_B,_Chronic
RHOH	IL2_STAT5_SIGNALING	Immunologic_Deficiency_Syndromes Lymphoma Lymphoma,_Follicular Primary_cutaneous_marginal_zone_B-cell_lymphoma Marginal_Zone_B-Cell_Lymphoma Primary_Cutaneous_Follicle_Center_Lymphoma T-lymphocyte_deficiency Chronic_Lymphocytic_Leukemia Hairy_Cell_Leukemia Thyroid_Lymphoma Exanthema Lymphopenia Diffuse_Large_B-Cell_Lymphoma Multiple_Myeloma Lymphoma,_Non-Hodgkin Hodgkin_Disease Leukemia,_Myelocytic,_Acute Epidermodysplasia_Verruciformis
STK39	ANDROGEN_RESPONSE	Hypertensive_disease Overweight Cystic_Fibrosis Cervix_carcinoma Essential_Hypertension Malignant_neoplasm_of_prostate Malignant_tumor_of_cervix Familial_Exudative_Vitreoretinopathy cervical_cancer Autistic_Disorder Prostate_carcinoma Malignant_neoplasm_of_breast B-Cell_Lymphomas Tumor_Progression Parkinson_Disease
SLC30A5	UNFOLDED_PROTEIN_RESPONSE	Diabetes_Mellitus,_Non-Insulin-Dependent Asthma Glioma
ANKRD2	MYOGENESIS	Diabetes_Mellitus Diabetes
MRPS11	OXIDATIVE_PHOSPHORYLATION	Liver_carcinoma
CSNK2A2	SPERMATOGENESIS	Malignant_neoplasm_of_prostate Malignant_neoplasm_of_lung Glioblastoma Squamous_cell_carcinoma_of_the_head_and_neck Brain_Neoplasms Cardiomyopathies Lymphoma Mammary_Neoplasms Prostate_carcinoma Male_infertility Malignant_neoplasm_of_pancreas Squamous_cell_carcinoma_of_lung Malignant_neoplasm_of_breast Liver_carcinoma Primary_malignant_neoplasm_of_lung Breast_Carcinoma Adenocarcinoma Mammary_Tumorigenesis Anaplastic_Large_Cell_Lymphoma,_ALK-Positive Oligospermia Carcinoma_of_lung Pancreatic_carcinoma Carcinogenesis Myotonic_Dystrophy
RAB14	PROTEIN_SECRETION	Renal_carcinoma Rett_Syndrome Non-Small_Cell_Lung_Carcinoma Malignant_neoplasm_of_kidney
SLC2A4	APICAL_SURFACE	Osteosarcoma Endometriosis Liver_carcinoma Embryonal_Rhabdomyosarcoma Alveolar_rhabdomyosarcoma Diabetes Colorectal_Cancer Stomach_Carcinoma Diabetes_Mellitus,_Insulin-Dependent B-Cell_Lymphomas Multiple_Myeloma Critical_illness_myopathy Malignant_neoplasm_of_pancreas Myeloid_Leukemia,_Chronic Coronary_Artery_Disease Diabetes_Mellitus,_Non-Insulin-Dependent Breast_Carcinoma Renal_Cell_Carcinoma Hypocholesterolemia Heart_failure Glycogen_Storage_Disease_Type_V Cardiomyopathy,_Familial_Idiopathic Hurthle_Cell_Tumor Ovarian_Carcinoma Gastrointestinal_Stromal_Tumors Congestive_heart_failure HIV_Infections Gastrointestinal_Stromal_Sarcoma Hypertensive_disease Malnutrition Clear-cell_metastatic_renal_cell_carcinoma Hyperglycemia Cirrhosis Malignant_neoplasm_of_breast Prediabetes_syndrome Hyperlipidemia Liver_Cirrhosis Hypoglycemia Renal_dysplasia Impaired_glucose_tolerance Polycystic_Ovary_Syndrome Hyperactive_behavior Osteosarcoma_of_bone Cardiomyopathy,_Dilated Obesity,_Visceral Chronic_Lymphocytic_Leukemia Obesity Adenocarcinoma Malignant_neoplasm_of_ovary Carcinogenesis Diabetes_Mellitus Colon_Carcinoma Epithelial_ovarian_cancer Glycogen_storage_disease_type_Id Squamous_cell_carcinoma Cardiovascular_Diseases Pancreatic_carcinoma Hyperinsulinism Oncocytic_Neoplasm Metabolic_Diseases Prostate_carcinoma Malignant_neoplasm_of_prostate Malignant_tumor_of_colon Neuropathy Oxyphilic_Adenoma Infantile_nystagmus_syndrome Benign_Ovarian_Neoplasm Colorectal_Carcinoma Adenocarcinoma,_Clear_Cell Liver_neoplasms Malignant_neoplasm_of_stomach
APAF1	P53_PATHWAY	Liver_carcinoma Secondary_malignant_neoplasm_of_liver Nevi_and_Melanomas Huntington_Disease TARSAL-CARPAL_COALITION_SYNDROME Malignant_neoplasm_of_ovary leukemia Tumor_Progression Lysinuric_Protein_Intolerance Carcinoma,_Transitional_Cell Stomach_Carcinoma Childhood_Acute_Lymphoblastic_Leukemia Malignant_tumor_of_colon Epithelial_ovarian_cancer Thyroid_Neoplasm Amyloidosis Carcinoma_of_bladder Nodular_melanoma Neoplasm_Metastasis Pancreatic_carcinoma Sarcoma Germ_cell_tumor Glioblastoma Amyotrophic_Lateral_Sclerosis Carcinoma_of_lung Hematologic_Neoplasms Neurodegenerative_Disorders Hepatitis_C Myelodysplasia Crohn_Disease Transitional_cell_carcinoma_of_bladder Chlamydia_Infections Myeloid_Leukemia,_Chronic Bladder_Neoplasm Malignant_neoplasm_of_lung Acute_lymphocytic_leukemia Primary_malignant_neoplasm_of_lung Lymphoma Myeloid_Leukemia Multiple_Myeloma Congenital_Abnormality Congenital_clubfoot MYELODYSPLASTIC_SYNDROME Colorectal_Carcinoma Colon_Carcinoma Gastrointestinal_Carcinoid_Tumor melanoma Protein_Deficiency Conventional_(Clear_Cell)_Renal_Cell_Carcinoma Metastatic_melanoma Prostate_carcinoma Leukemogenesis Adenocarcinoma Malignant_neoplasm_of_prostate Precursor_Cell_Lymphoblastic_Leukemia_Lymphoma Leukemia,_Myelocytic,_Acute Laryngeal_Squamous_Cell_Carcinoma Blast_Phase Renal_carcinoma Central_neuroblastoma Unipolar_Depression Glioma Carcinogenesis Ulcer Parkinson_Disease Malignant_neoplasm_of_large_intestine Major_Depressive_Disorder Cutaneous_Melanoma Kidney_Neoplasm Malignant_neoplasm_of_pancreas Non-Small_Cell_Lung_Carcinoma Lymphocytic_infiltration Osteosarcoma Osteosarcoma_of_bone Malignant_neoplasm_of_stomach Adenoma Neuroblastoma Renal_Cell_Carcinoma Spina_Bifida Ovarian_Carcinoma Burkitt_Lymphoma Chronic_Lymphocytic_Leukemia Neonatal_Deformity Colorectal_Cancer Malignant_neoplasm_of_kidney Acute_leukemia Malignant_neoplasm_of_urinary_bladder Fetal_Distress
