name	hallmark	disease
SHH	HEDGEHOG_SIGNALING	Dermoid_Cyst Biliary_Atresia Intellectual_Disability Monophthalmos Gallbladder_Carcinoma Poorly_differentiated_carcinoma Gastritis,_Atrophic SOLITARY_MEDIAN_MAXILLARY_CENTRAL_INCISOR Desmoplastic_Medulloblastoma Bardet-Biedl_Syndrome Rheumatic_Fever Isochromosomes Keratocystic_Odontogenic_Tumor Cleft_Palate Situs_Inversus melanoma Medullary_carcinoma_of_thyroid Retinoblastoma Rheumatoid_Arthritis Infection_caused_by_Helicobacter_pylori Nevus_sebaceous Semilobar_Holoprosencephaly Erectile_dysfunction Congenital_contractural_arachnodactyly Diabetic_Neuropathies Tumor_Progression Calcifying_Epithelial_Odontogenic_Tumor Colorectal_Cancer Congenital_anomaly_of_brain Papillary_thyroid_carcinoma Currarino_triad Prostatic_Neoplasms POLYDACTYLY,_PREAXIAL_II_(disorder) Gastrointestinal_Neoplasms Congenital_diaphragmatic_hernia Anorectal_Malformations Secondary_malignant_neoplasm_of_bone Multiple_Myeloma Stenosis_of_duodenum Syndactyly Neuroectodermal_Tumor,_Primitive Craniofacial_Abnormalities Oculo-dento-digital_syndrome Acute_Erythroblastic_Leukemia Hypoplastic_tibia_and_postaxial_polydactyly_syndrome Developmental_Disabilities Inflammatory_Breast_Carcinoma Polydactyly Attention_deficit_hyperactivity_disorder Refractory_anemias Anaplastic_large_cell_lymphoma,_ALK_negative Caudal_Regression_Syndrome Childhood_Medulloblastoma Childhood_Brain_Neoplasm Liver_carcinoma Fibrosis,_Liver Stromal_Neoplasm Radial_polydactyly Carcinoma,_Transitional_Cell Gastric_Adenocarcinoma Tumor_Angiogenesis Squamous_cell_carcinoma_of_oropharynx Multiple_Sclerosis Seizures Central_neuroblastoma Gastric_ulcer Glioblastoma Carcinogenesis Stage_IV_Bladder_Cancer_AJCC_v6 Pancreatitis,_Chronic Li-Fraumeni_Syndrome Hypopituitarism Thyroid_carcinoma Colitis Breast_Carcinoma Malignant_Childhood_Neoplasm Gastrointestinal_Stromal_Tumors Triple_Negative_Breast_Neoplasms Precancerous_Conditions Gastritis Lung_diseases Blast_Phase Fibroid_Tumor Uterine_Fibroids MYELODYSPLASTIC_SYNDROME Cerebral_Infarction Situs_ambiguus DiGeorge_Syndrome Embryonal_Neoplasm Urothelial_Carcinoma Tumors_of_Adrenal_Cortex Hamman-Rich_syndrome Malignant_neoplasm_of_gallbladder Recurrent_Medulloblastoma Ulcer Ataxia_Telangiectasia Malignant_lymphoma,_lymphocytic,_intermediate_differentiation,_diffuse Squamous_cell_carcinoma_of_skin Thyroid_Neoplasm Cyclic_neutropenia Congenital_chromosomal_disease Congenital_ocular_coloboma_(disorder) Diabetes Malignant_neoplasm_of_pancreas Smith-Lemli-Opitz_Syndrome Malignant_neoplasm_of_stomach Williams_Syndrome Cerebellar_Hypoplasia Lip_and_Oral_Cavity_Carcinoma Carcinoma_of_lung polyps Malignant_neoplasm_of_tongue Mood_Disorders Classic_medulloblastoma Chromosome_2,_trisomy_2p Idiopathic_Pulmonary_Fibrosis Lobar_Holoprosencephaly stage,_ovarian_epithelial_cancer Epilepsy Amaurosis_congenita_of_Leber,_type_1 HIV_Infections Brain_Neoplasms Meckel_Diverticulum Abnormality_of_limb_bone_morphology Microphthalmos Encephalomyelitis Malignant_neoplasm_of_mouth Neoplasm_Metastasis Cyst Hereditary_hemochromatosis Mesothelioma Hypospadias Ovarian_Teratoma Ectopic_gastric_tissue Cerebrovascular_accident Carcinoma_of_bladder Colorectal_Carcinoma Monosomy Non-alcoholic_Fatty_Liver_Disease Congenital_absence_of_tibia Schizencephaly Hidradenitis_Suppurativa Secondary_malignant_neoplasm_of_liver Malignant_Neoplasms Rhabdomyosarcoma LAURIN-SANDROW_SYNDROME Glioblastoma_Multiforme Anus,_Imperforate Hydrocephalus Adrenocortical_carcinoma Chromosome_10,_monosomy_10q Malignant_neoplasm_of_esophagus Craniopharyngioma Congenital_Abnormality Cyclocephaly Epilepsy,_Temporal_Lobe Myopathy Kidney_Failure,_Acute Non-Small_Cell_Lung_Carcinoma Malignant_neoplasm_of_brain Corneal_Neovascularization Hypoalgesia Acute_respiratory_failure Metastatic_Neoplasm Pancreatic_Neoplasm Lysosomal_Storage_Diseases Sacral_agenesis Malignant_neoplasm_of_urinary_bladder Neuroblastoma Limb_Deformities,_Congenital Basal_Cell_Nevus_Syndrome Squamous_cell_carcinoma Recurrent_Carcinoma Penile_hypospadias Colorectal_Neoplasms Congenital_defects Pancreatic_carcinoma Residual_Cancer Neurilemmoma Parkinson_Disease Malignant_neoplasm_of_prostate Pancreatic_intraepithelial_neoplasia Primary_malignant_neoplasm Rubinstein-Taybi_Syndrome Cleft_upper_lip Systemic_Scleroderma Lymphoma Jeune_thoracic_dystrophy Malignant_neoplasm_of_breast Pleuropulmonary_blastoma Desmoplastic Adenocarcinoma_of_pancreas Colonic_Neoplasms Chronic_graft-versus-host_disease Tongue_Carcinoma Malignant_neoplasm_of_thyroid Adenomatous_Polyposis_Coli Complete_trisomy_18_syndrome Glioma Sebaceous_Adenocarcinoma Niemann-Pick_Disease,_Type_C1 Hypertrichosis Triphalangeal_thumb Progressive_pseudorheumatoid_dysplasia Secondary_malignant_neoplasm_of_lymph_node Cleft_lip_or_lips Medulloblastoma Meckel_syndrome_type_1 Hereditary_gingival_fibromatosis Primary_malignant_neoplasm_of_lung Cleft_palate,_isolated Cerebral_Ischemia Adult_Medulloblastoma Spindle_cell_hemangioma Pulmonary_Fibrosis Degenerative_polyarthritis Xeroderma_Pigmentosum Adenoma Holoprosencephaly Odontogenic_Tumors Anaplastic_thyroid_carcinoma Neural_Tube_Defects Adenocarcinoma Congenital_hypoplasia_of_lung Polysyndactyly Stomach_Carcinoma Adenoma_of_large_intestine Down_Syndrome Bladder_Neoplasm Malignant_tumor_of_colon Panhypopituitarism Nonspecific_interstitial_pneumonia Congenital_anomaly_of_the_kidney Pancreatitis Colon_Carcinoma Skin_Neoplasms Prostate_carcinoma Esophageal_Atresia VACTERL_Association Malignant_neoplasm_of_lung Hyperlipoproteinemias Experimental_Organism_Basal_Cell_Carcinoma Syndactyly,_Type_IV Skin_Carcinogenesis Pancreatic_Ductal_Adenocarcinoma Malignant_neoplasm_of_skin Uranostaphyloschisis Ameloblastoma Early_gastric_cancer Diabetes_Mellitus,_Insulin-Dependent Healing_ulcer Hyperplastic_Polyp Clear_cell_sarcoma_of_kidney Diabetes_Mellitus Familial_aplasia_of_the_vermis Adenocarcinoma_of_lung_(disorder) Malignant_Head_and_Neck_Neoplasm
NOS2	ALLOGRAFT_REJECTION	Multiple_Chemical_Sensitivity Fibromyalgia Anemia_due_to_infection Cardiomyopathies Leukemia,_Myelocytic,_Acute Malignant_neoplasm_of_ovary Liver_diseases Ileal_Pouches Melanocytic_nevus Mammary_Neoplasms Non-obstructive_reflux-associated_chronic_pyelonephritis_(disorder) Athlete's_heart Seizures polyps Idiopathic_Hypereosinophilic_Syndrome Tuberculosis,_Pulmonary Colorectal_Cancer HIV_Encephalopathy IGA_Glomerulonephritis Acute_anaemia Leukemia,_T-Cell Leukemogenesis Arteriosclerosis Carcinoma_of_bladder Malignant_neoplasm_of_prostate Glioma Glaucoma Brain_Diseases Osteitis Rectal_Carcinoma Colorectal_Carcinoma Chronic_kidney_disease_stage_5 Sarcoma Bipolar_Disorder Adenocarcinoma_of_large_intestine Hypertensive_disease Alzheimer's_Disease Parasitic_Diseases Henoch-Schoenlein_Purpura Nasal_Type_Extranodal_NK/T-Cell_Lymphoma Nasopharyngeal_carcinoma Depressive_disorder Rheumatoid_Arthritis Cachexia Coronary_Artery_Disease Cognition_Disorders Bronchiolitis Non-Small_Cell_Lung_Carcinoma Colorectal_cancer_metastatic Chronic_rhinitis melanoma Lymphoepithelioid_lymphoma_(clinical) Diabetic_Nephropathy Meningioma Cerebrovascular_Disorders Hepatitis_A Mast-Cell_Sarcoma Polymyositis High-Grade_Squamous_Intraepithelial_Lesions Malignant_neoplasm_of_lung Nevus Endometriosis Malaria Virus_Diseases Adenomatous_polyp_of_colon Autoimmune_Diseases Cholangiocarcinoma Low_Grade_Squamous_Intraepithelial_Neoplasia Lymphoma Eosinophilic_leukemia Stomach_Carcinoma Mesangial_proliferative_glomerulonephritis Coronary_heart_disease Amyloidosis Gastric_Adenocarcinoma leukemia Sepsis Adenocarcinoma Rett_Syndrome Meniere_Disease Bacterial_Infections Periapical_Granuloma Multiple_Sclerosis,_Relapsing-Remitting VITILIGO-ASSOCIATED_MULTIPLE_AUTOIMMUNE_DISEASE_SUSCEPTIBILITY_1_(finding) Amyotrophic_Lateral_Sclerosis Vascular_Diseases MILES-CARPENTER_X-LINKED_MENTAL_RETARDATION_SYNDROME Septicemia Retinal_Diseases Schizophrenia Glioblastoma Malignant_Neoplasms Synovial_Cyst Gallbladder_Carcinoma Carcinoma_of_lung Systemic_Scleroderma Impaired_cognition Heart_Diseases Squamous_cell_carcinoma ovarian_neoplasm Malignant_neoplasm_of_urinary_bladder Glaucoma,_Primary_Open_Angle Atherosclerosis Muscular_Dystrophy,_Duchenne Pulmonary_Emphysema Disorder_of_the_optic_nerve Chronic_myeloproliferative_disorder Primary_malignant_neoplasm_of_lung Frontotemporal_dementia Anemia Marginal_Zone_B-Cell_Lymphoma Diabetic_Retinopathy HIV_encephalitis Nasal_and_nasal-type_NK/T-cell_lymphoma Tumor_Angiogenesis Bladder_Neoplasm Lupus_Erythematosus,_Systemic Colon_Carcinoma Leishmaniasis Adenoid_Cystic_Carcinoma Triple_Negative_Breast_Neoplasms Malignant_neoplasm_of_gallbladder Cholelithiasis Fatigue Salivary_duct_carcinoma Respiratory_syncytial_virus_(RSV)_infection_in_conditions_classified_elsewhere_and_of_unspecified_site Vitiligo Motor_symptoms Disorder_of_Achilles_tendon pediatric_AIDS Brain_Neoplasms Cerebral_Infarction Hyperargininemia Malaria,_Cerebral Ulcer Headache Manic Blackout_-_symptom Metabolic_Syndrome_X Pneumonia Schistosomiasis Kidney_Diseases Pervasive_Development_Disorder Congestive_heart_failure Chronic_Lymphocytic_Leukemia Asthma Hydrosalpinx_(disease) Colitis Carcinogenesis Adenocarcinoma_of_colon Malaria,_Falciparum Heart_failure Ki-1+_Anaplastic_Large_Cell_Lymphoma Meconium_Aspiration_Syndrome Myocardial_Ischemia B-Cell_Lymphomas T-Cell_Lymphoma Cerebral_Palsy Lymphoma,_Non-Hodgkin Dermatomyositis Medullary_carcinoma_of_thyroid MYELODYSPLASTIC_SYNDROME Liver_carcinoma Acute_Chest_Syndrome Neoplasm_Metastasis Neoplasms Adult_type_dermatomyositis Malignant_tumor_of_colon Invasive_Lobular_Breast_Carcinoma Leishmaniasis,_Visceral Tuberculosis Acute_lymphocytic_leukemia Subarachnoid_Hemorrhage Cluster_Headache Prostate_carcinoma Down_Syndrome Histiocytosis_haematophagic Gastritis Myxoid_cyst Diffuse_Large_B-Cell_Lymphoma Esophageal_Achalasia Hyperactive_behavior Hepatitis_C Mucosa-Associated_Lymphoid_Tissue_Lymphoma Plaque,_Amyloid Diabetes_Mellitus,_Insulin-Dependent Acute_monocytic/monoblastic_leukemia Ureteral_obstruction Breast_Carcinoma Shigella_Infections Diarrhea Malignant_lymphoma_-_lymphoplasmacytic Enteropathy-Associated_T-Cell_Lymphoma Erectile_dysfunction Malignant_Fibrous_Histiocytoma Psychotic_symptom Waldenstrom_Macroglobulinemia Tumor_Progression Influenza Asperger_Syndrome Malignant_neoplasm_of_stomach Diabetes Celiac_Disease Ovarian_Carcinoma Cerebral_Ischemia Attention_deficit_hyperactivity_disorder Chlamydia_Infections Mental_Depression Corneal_pannus Common_Cold Parasitic_infection Necrotizing_enterocolitis_in_fetus_OR_newborn Multiple_Sclerosis Reflux_nephropathy_(disorder) Respiratory_Syncytial_Virus_Infections Adenocarcinoma,_Basal_Cell Herpes_Simplex_Infections Mycobacterium_Infections Cardiovascular_Diseases Encephalomyelitis Autistic_Disorder Benign_melanocytic_nevus Ocular_Hypertension nervous_system_disorder Vasculitis Diabetes_Mellitus Arthritis Giant_Cell_Arteritis Lymphoma,_Follicular Cutaneous_Melanoma Pyogenic_granuloma_of_skin Angioimmunoblastic_Lymphadenopathy Colonic_Polyps Chronic_inflammatory_disorder Chronic_Obstructive_Airway_Disease Adenomatous_Polyposis_Coli Pancreatic_Neoplasm Renal_carcinoma Primary_sclerosing_cholangitis Liver_neoplasms Prostatic_Diseases HIV_Infections Stable_angina Infection_caused_by_Helicobacter_pylori Essential_Hypertension Hepatitis_C,_Chronic Renal_Insufficiency Osteopenia Intracranial_Aneurysm Chronic_viral_hepatitis Papillary_thyroid_carcinoma Cardiomyopathy,_Dilated Primary_ulcer_of_intestine Chronic_Fatigue_Syndrome Cystic_Fibrosis Achalasia Cardiovascular_Pathology gastritis_h_pylori Myocardial_Infarction Behcet_Syndrome Infant,_Premature Jet_Lag_Syndrome Chronic_heart_failure Primary_Cutaneous_Anaplastic_Large_Cell_Lymphoma Endothelial_dysfunction Parkinson_Disease Cardiac_Arrest Metaplastic_carcinoma Colorectal_Neoplasms Peripheral_T-Cell_Lymphoma Crohn_Disease prostatitis Human_anaplasmosis_due_to_Anaplasma_phagocytophilum Pouchitis Hyperglycemia Rhinovirus_infection Migraine_with_Aura Optic_Neuropathy Coronary_Arteriosclerosis Nephritis Carotid_Artery_Plaque Malignant_neoplasm_of_kidney Cerebral_arterial_aneurysm Adult_T-Cell_Lymphoma/Leukemia Chronic_eosinophilic_leukemia Effects_of_heat Familial_lichen_amyloidosis Pyogenic_granuloma Central_neuroblastoma Obesity lymph_node_infected Restenosis Alcoholic_blackout Chagas_Disease Kidney_Failure,_Chronic Malignant_Head_and_Neck_Neoplasm Myocarditis Arthritis,_Psoriatic Sickle_Cell_Trait Neuroblastoma Gastroesophageal_reflux_disease Lipomatosis,_Multiple_Symmetrical Diabetes_Mellitus,_Non-Insulin-Dependent Squamous_cell_carcinoma_of_the_head_and_neck Sarcoma,_Spindle_Cell Leukopenia Chest_Pain Tendinopathy Encephalitis Male_infertility Anastomosis Ulcerative_Colitis Cerebrovascular_accident aggressive_cancer Bronchiectasis Senile_angioma Psoriasis Cardiovascular_Abnormalities Idiopathic_pulmonary_arterial_hypertension basal_cell_adenocarcinoma_of_salivary_gland Malignant_neoplasm_of_breast Inclusion_Body_Myopathy,_Sporadic Hepatitis Autism_Spectrum_Disorders Benign_Prostatic_Hyperplasia androgen_independent_prostate_cancer Secondary_malignant_neoplasm_of_liver Migraine_Disorders
NFASC	APICAL_JUNCTION	Schizophrenia Multiple_Sclerosis Carcinoma_of_lung Malignant_neoplasm_of_lung Primary_malignant_neoplasm_of_lung Multifocal_motor_neuropathy Polyradiculoneuropathy,_Chronic_Inflammatory_Demyelinating
GAD2	FATTY_ACID_METABOLISM	Spasm insulinoma Huntington_Disease Anxiety_Disorders Muscular_stiffness Anxiety Diabetes_Mellitus,_Non-Insulin-Dependent Pain Precocious_pubarche Schizoaffective_Disorder PANIC_DISORDER_1 Kidney_Diseases Chronic_pain Mood_Disorders Stiff-Person_Syndrome Obsessive-Compulsive_Disorder Retinal_Diseases Parkinson_Disease NEUROTICISM Narcolepsy Diabetes,_Autoimmune Hyperalgesia,_Thermal Latent_Autoimmune_Diabetes_in_Adults Alcoholic_Intoxication,_Chronic Autoimmune_Primary_Adrenal_Insufficiency Autistic_Disorder Myxoid_cyst Coxsackievirus_Infections Obesity,_Morbid Smith-Magenis_syndrome Diabetes_Mellitus Connective_tissue_inflammation Metabolic_Diseases Parkinsonian_Disorders Hypoglycemia Diagnosis,_Psychiatric Major_Depressive_Disorder MYOTONIC_DYSTROPHY_1 Latent_autoimmune_diabetes_mellitus_in_adult Diabetes Seizures Thyroid_Diseases West_Nile_viral_infection Panic_Disorder Juvenile_Neuronal_Ceroid_Lipofuscinosis Enterovirus_Infections Prediabetes_syndrome Addison_Disease Schizophrenia Autoimmune_Diseases Bronchopulmonary_Dysplasia Obesity Graves_Disease Pediatric_Obesity Malnutrition Agnosia_for_Pain Completed_Suicide Generalized_Anxiety_Disorder Hashimoto_Disease Neuralgia Malignant_neoplasm_of_pancreas Thyrotoxicosis Bipolar_Disorder Diabetes_Mellitus,_Insulin-Dependent Abnormal_behavior Pancreatic_carcinoma Borderline_Personality_Disorder Unipolar_Depression
CALM1	COMPLEMENT	Osteosarcoma Liver_neoplasms Precursor_T-Cell_Lymphoblastic_Leukemia-Lymphoma Malignant_Peripheral_Nerve_Sheath_Tumor Breast_Carcinoma Tachycardia,_Ventricular Quebec_platelet_disorder Acute_lymphocytic_leukemia Mental_Depression Neuroblastoma Malignant_neoplasm_of_breast Malignant_neoplasm_of_gastrointestinal_tract Hyperactive_behavior Osteoarthritis_of_hip Leukemia,_Myelocytic,_Acute Cervix_carcinoma M5b_Acute_differentiated_monocytic_leukemia Malignant_neoplasm_of_gallbladder Heart_Diseases Gallbladder_Carcinoma Congenital_long_QT_syndrome Pseudoachondroplasia Anxiety_Disorders Leukemogenesis Cerebrovascular_accident Primary_malignant_neoplasm_of_lung Cardiomyopathy,_Hypertrophic,_Familial Measles Arthritis,_Reactive Tuberous_Sclerosis Neurofibromatosis_1 Papillary_thyroid_carcinoma CATARACT,_NONNUCLEAR_POLYMORPHIC_CONGENITAL,_AUTOSOMAL_DOMINANT Addictive_Behavior Lymphoma,_Non-Hodgkin Chronic_Lymphocytic_Leukemia Melanoma,_B16 Malignant_neoplasm_of_kidney Cardiomyopathy,_Familial_Idiopathic Cholangiocarcinoma Gastrointestinal_Carcinoid_Tumor Atrial_Fibrillation Glioma Fibrosarcoma Leishmaniasis,_Cutaneous Heart_failure Myocardial_Ischemia Epithelial_ovarian_cancer Liver_carcinoma leukemia melanoma Stomach_Carcinoma Rheumatoid_Arthritis Non-Small_Cell_Lung_Carcinoma Schizophrenia Lymphoma Obesity Medulloblastoma Astrocytoma Long_QT_Syndrome Myeloid_Leukemia,_Chronic Enterovirus_Infections Chronic_atrial_fibrillation Pancreatic_carcinoma Depressive_disorder Acute_Megakaryocytic_Leukemias Neurodegenerative_Disorders Adenoma Congestive_heart_failure Multiple_Epiphyseal_Dysplasia Residual_Cancer Cardiac_Arrest Pertussis Malignant_neoplasm_of_ovary Parathyroid_Adenoma Drug_abuse Adult_onset_autosomal_dominant_leukodystrophy Ductal_Carcinoma Spastic_Paraplegia Cerebellar_Ataxia VENTRICULAR_TACHYCARDIA,_CATECHOLAMINERGIC_POLYMORPHIC,_1_(disorder) MASA_SYNDROME_(disorder) Conventional_(Clear_Cell)_Renal_Cell_Carcinoma Malignant_lymphoma,_lymphocytic,_intermediate_differentiation,_diffuse Mesothelioma Cerebral_Infarction Adult_Non-Hodgkin_Lymphoma Meningioma Prostate_carcinoma Hodgkin_Disease Glioblastoma Glycogen_Storage_Disease_Type_VII Sarcoma Carcinogenesis Retinoblastoma Diabetic_Cardiomyopathies Tumor_Progression Cardiac_arrest_in_children Cystic_Fibrosis Osteosarcoma_of_bone Van_der_Woude_syndrome Hereditary_pancreatitis Down_Syndrome Paroxysmal_familial_ventricular_fibrillation Sjogren's_Syndrome Central_neuroblastoma Small_cell_carcinoma_of_lung Multiple_Myeloma Liver_and_Intrahepatic_Biliary_Tract_Carcinoma African_Trypanosomiasis Monocytic_leukemia Whooping_cough_due_to_unspecified_organism Myeloid_Leukemia Malignant_neoplasm_of_stomach Lymphangioleiomyomatosis Gastric_Adenocarcinoma Huntington_Disease X-linked_hydrocephalus_syndrome Degenerative_polyarthritis Squamous_cell_carcinoma Epilepsy,_Temporal_Lobe Diabetes_Mellitus,_Insulin-Dependent MIXED_LINEAGE_LEUKEMIA Renal_dysplasia_and_retinal_aplasia_(disorder) Metastatic_melanoma Malignant_neoplasm_of_pancreas Cardiomyopathy,_Dilated CATARACT,_MARNER_TYPE Specific_language_impairment Cataract Childhood_Non-Hodgkin_Lymphoma Ventricular_arrhythmia Osteoporosis Angelman_Syndrome Timothy_syndrome Adenocarcinoma Multiple_Sclerosis Anemia,_Sickle_Cell HYPOCALCIURIC_HYPERCALCEMIA,_FAMILIAL,_TYPE_III Renal_carcinoma Ataxia Carcinoma_of_lung Malignant_tumor_of_cervix Neoplasm_Metastasis cervical_cancer Marijuana_Abuse Brugada_Syndrome_(disorder) Prostatic_Neoplasms Diffuse_Large_B-Cell_Lymphoma Hypertensive_disease Idiopathic_scoliosis Learning_Disabilities Cavernous_Hemangioma_of_Brain Tuberculosis Stress,_Psychological Malignant_Glioma Malignant_neoplasm_of_liver Medullary_carcinoma_of_thyroid Colon_Carcinoma Asthma Ovarian_Carcinoma Epilepsy Acute_leukemia Malignant_neoplasm_of_lung Alzheimer's_Disease NEUROFIBROMATOSIS,_TYPE_1-LIKE_SYNDROME Chronic_heart_failure Malignant_neoplasm_of_prostate Teratoma Glioblastoma_Multiforme Congenital_cerebellar_ataxia Cerebral_Ischemia Hyperlipoproteinemia_Type_IIa Hypothyroidism Congenital_cataract
PSMC3	UV_RESPONSE_UP	Breast_Carcinoma Malignant_neoplasm_of_breast
HK1	HYPOXIA	Inclusion_Body_Myositis_(disorder) Tumor_Progression Gilles_de_la_Tourette_syndrome Hereditary_Motor_and_Sensory_Neuropathies Myopathies,_Nemaline Arthritis Ubiquinone_dehydrogenase_deficiency Malignant_neoplasm_of_breast Stomach_Carcinoma Non-Small_Cell_Lung_Carcinoma Polyarthritis Anemia Charcot-Marie-Tooth_Disease Lung_Neoplasms Liver_carcinoma Carcinoma_of_lung Liver_neoplasms Retinitis_Pigmentosa Hereditary_spherocytosis Schizophrenia Klatskin_Tumor Maturity_onset_diabetes_mellitus_in_young Diabetes_Mellitus,_Non-Insulin-Dependent Autosomal_dominant_retinitis_pigmentosa Malignant_Glioma Glioma Obesity Recurrent_tumor Anemia,_Hemolytic Nonspherocytic_hemolytic_anemia Glioblastoma_Multiforme Endometriosis Malaria Prostate_carcinoma Glioblastoma Malignant_neoplasm_of_prostate Alzheimer's_Disease Attention_deficit_hyperactivity_disorder Carcinogenesis Fibrosarcoma nervous_system_disorder Squamous_cell_carcinoma Malignant_neoplasm_of_stomach Hyperactive_behavior insulinoma Carcinoma_breast_stage_IV ATRICHIA_WITH_PAPULAR_LESIONS Breast_Carcinoma Primary_malignant_neoplasm_of_lung Solid_Neoplasm Deficiency_of_hexokinase_(disorder) Acute_Promyelocytic_Leukemia Primary_biliary_cirrhosis Malignant_neoplasm_of_brain Malignant_neoplasm_of_lung
PABPC4	MYC_TARGETS_V1	Down_Syndrome Malignant_tumor_of_cervix Cervix_carcinoma Alzheimer's_Disease cervical_cancer Senile_Plaques Neurodegenerative_Disorders Central_neuroblastoma Neuroblastoma
